{
  "type": "assistant.ideActionProposal",
  "version": "2026-05-15",
  "requiresUserConfirmation": true,
  "cloudRequired": false,
  "summary": "Reveal the chat view state range.",
  "action": "revealWorkspaceRange",
  "workspaceRelativePath": "apps/gui/src/services/chatViewState.ts",
  "range": {
    "start": { "line": 12, "character": 0 },
    "end": { "line": 18, "character": 12 }
  }
}
